{
  "schema_version": "3.0",
  "workflow_version": "3.1.0",
  "project_id": "replace-me",
  "status": "NOT_STARTED",
  "public_episode_count": 4,
  "story_part_count": 16,
  "story_parts_per_episode": 4,
  "episode_target_minutes": 60,
  "episode_min_runtime_seconds": 3600,
  "episodes": [
    {
      "episode_id": "EP01",
      "episode_number": 1,
      "story_part_ids": [
        1,
        2,
        3,
        4
      ],
      "planned_min_runtime_seconds": 3600,
      "runtime_seconds": null,
      "runtime_evidence": null
    },
    {
      "episode_id": "EP02",
      "episode_number": 2,
      "story_part_ids": [
        5,
        6,
        7,
        8
      ],
      "planned_min_runtime_seconds": 3600,
      "runtime_seconds": null,
      "runtime_evidence": null
    },
    {
      "episode_id": "EP03",
      "episode_number": 3,
      "story_part_ids": [
        9,
        10,
        11,
        12
      ],
      "planned_min_runtime_seconds": 3600,
      "runtime_seconds": null,
      "runtime_evidence": null
    },
    {
      "episode_id": "EP04",
      "episode_number": 4,
      "story_part_ids": [
        13,
        14,
        15,
        16
      ],
      "planned_min_runtime_seconds": 3600,
      "runtime_seconds": null,
      "runtime_evidence": null
    }
  ]
}
